{
  "$schema": "https://json-schema.org/draft/2020-12/schema",
  "$id": "https://github.com/finding-bridge/schemas/finding.schema.json/0.5.0",
  "title": "Canonical finding (finding-bridge)",
  "description": "One AI red-team finding. Charter section 7. Raw harmful content is NEVER inline: raw_response_sealed is a reference into the sealed store. Unknown values are null, never invented (charter: never fabricate).",
  "type": "object",
  "additionalProperties": false,
  "required": [
    "record_type",
    "schema_version",
    "id",
    "source_tool",
    "source_tool_version",
    "target_model",
    "target_model_version",
    "discovered_at",
    "probe",
    "raw_response_sealed",
    "preview",
    "harm_flags",
    "taxonomy",
    "severity",
    "reproduction",
    "provenance",
    "dedup"
  ],
  "properties": {
    "schema_version": {
      "const": "0.5.0",
      "description": "Version of this canonical schema. Minor bump adds fields; major bump changes or removes them (charter section 7). 0.2.0 added provenance.attestation_hash (review finding R-1). 0.3.0 made discovered_at nullable (D-024, breaking change within pre-1.0; migration note in docs/decisions/schema-0.3.0-migration.md). 0.4.0 added record_type (major: a new required field), so the ledger can hold supersession records beside findings (D-051). 0.5.0 added taxonomy.atlas, remediation, and id patterns on every taxonomy array (D-071; minor: fields added, nothing required; migration note in docs/decisions/schema-0.5.0-migration.md)."
    },
    "id": {
      "type": "string",
      "minLength": 1,
      "description": "Stable content-derived id: 'fb-' + first 16 hex chars (64 bits) of the SHA-256 content hash. Stated limit (R-9): the truncation bounds DISPLAY identity only (birthday collision ~50% near 2^32 findings); dedup keys are recomputed from full content and the full 256-bit hash lives in provenance.content_hash, so the truncation bounds display identity, not dedup correctness. dedup.duplicate_of links by this id. Stated limit (C-004/D-028): ids are STORE-LOCAL, not content-identity across stores - sealed refs are keyed per store and sit inside the hashed content, so the same finding ingested into two stores carries two different ids; cross-store correlation by id does not work in v1."
    },
    "source_tool": {
      "type": "string",
      "minLength": 1,
      "description": "e.g. garak, manual-transcript."
    },
    "source_tool_version": {
      "type": [
        "string",
        "null"
      ]
    },
    "target_model": {
      "type": [
        "string",
        "null"
      ]
    },
    "target_model_version": {
      "type": [
        "string",
        "null"
      ]
    },
    "discovered_at": {
      "type": [
        "string",
        "null"
      ],
      "format": "date-time",
      "description": "ISO 8601 timestamp of discovery, or null when the source does not record one (e.g. garak hitlogs carry no timestamp; the charter forbids inventing one)."
    },
    "probe": {
      "type": "object",
      "additionalProperties": false,
      "required": [
        "value",
        "sealed_ref"
      ],
      "description": "The attack/prompt used. If harmful, value is null and sealed_ref points into the sealed store.",
      "properties": {
        "value": {
          "type": [
            "string",
            "null"
          ]
        },
        "sealed_ref": {
          "type": [
            "string",
            "null"
          ]
        }
      }
    },
    "raw_response_sealed": {
      "type": [
        "string",
        "null"
      ],
      "description": "Sealed-store blob reference. Never inline raw harm."
    },
    "preview": {
      "type": [
        "string",
        "null"
      ],
      "description": "Grey-scale/summary safe-to-read rendering."
    },
    "harm_flags": {
      "type": "array",
      "items": {
        "type": "string"
      },
      "description": "Detected harmful-content categories."
    },
    "taxonomy": {
      "type": "object",
      "additionalProperties": false,
      "required": [
        "owasp_llm",
        "saif"
      ],
      "properties": {
        "owasp_llm": {
          "type": "array",
          "items": {
            "$ref": "#/$defs/owasp_llm_entry"
          }
        },
        "saif": {
          "type": "array",
          "items": {
            "$ref": "#/$defs/saif_entry"
          }
        },
        "atlas": {
          "type": "array",
          "items": {
            "$ref": "#/$defs/atlas_entry"
          },
          "description": "MITRE ATLAS technique ids (0.5.0, D-071). Optional; absent or empty means no claim. Populated at the human gate or as suggested by the caged --ai path, never invented by an adapter."
        }
      },
      "description": "Each array constrains the SHAPE of what is claimed and never requires a claim: empty and absent are always legal (D-071)."
    },
    "severity": {
      "type": "object",
      "additionalProperties": false,
      "required": [
        "score",
        "rubric",
        "rationale",
        "status"
      ],
      "properties": {
        "score": {
          "type": [
            "number",
            "null"
          ],
          "minimum": 0,
          "maximum": 10,
          "description": "Stated behaviour (ruled at STEP-02 stop one): canonical serialization is RFC 8785, so integral floats collapse to integers - a score of 6.0 hashes identically to 6, and two findings differing only in that respect are the same finding."
        },
        "rubric": {
          "type": "object",
          "additionalProperties": false,
          "required": [
            "exploitability",
            "impact_scope",
            "data_sensitivity",
            "effort"
          ],
          "description": "LLM-adapted rubric per charter section 7 (Repello source, Pain-1): CVSS is not well-adapted to LLM flaws.",
          "properties": {
            "exploitability": {
              "$ref": "#/$defs/rubric_dimension"
            },
            "impact_scope": {
              "$ref": "#/$defs/rubric_dimension"
            },
            "data_sensitivity": {
              "$ref": "#/$defs/rubric_dimension"
            },
            "effort": {
              "$ref": "#/$defs/rubric_dimension"
            }
          }
        },
        "rationale": {
          "type": [
            "string",
            "null"
          ]
        },
        "status": {
          "enum": [
            "confirmed",
            "suggested",
            null
          ],
          "description": "suggested only ever set by the caged optional AI (charter rule 2); confirmed requires the human gate."
        }
      }
    },
    "reproduction": {
      "type": "object",
      "additionalProperties": false,
      "required": [
        "steps",
        "environment"
      ],
      "properties": {
        "steps": {
          "type": "array",
          "items": {
            "type": "string"
          }
        },
        "environment": {
          "type": [
            "object",
            "null"
          ],
          "description": "Free-form environment facts (model endpoint, temperature, harness). Null when unknown."
        }
      }
    },
    "provenance": {
      "type": "object",
      "additionalProperties": false,
      "required": [
        "content_hash",
        "prev_hash",
        "confirmed_by",
        "confirmed_at",
        "attestation_hash"
      ],
      "description": "Tamper-evident chain (charter). confirmed_by null means NOT a confirmed finding; emission must refuse (contract 3.3). attestation_hash binds who/when to the content hash so the gate record itself is tamper-evident (review finding R-1).",
      "properties": {
        "content_hash": {
          "type": [
            "string",
            "null"
          ],
          "pattern": "^[0-9a-f]{64}$",
          "description": "SHA-256 hex of canonical content, set by core/provenance."
        },
        "prev_hash": {
          "type": [
            "string",
            "null"
          ],
          "pattern": "^[0-9a-f]{64}$"
        },
        "confirmed_by": {
          "type": [
            "string",
            "null"
          ],
          "description": "git config user.name + email of the confirming human (ruling D-011)."
        },
        "confirmed_at": {
          "type": [
            "string",
            "null"
          ],
          "format": "date-time"
        },
        "attestation_hash": {
          "type": [
            "string",
            "null"
          ],
          "pattern": "^[0-9a-f]{64}$",
          "description": "SHA-256 over (content_hash, confirmed_by, confirmed_at), domain-separated. Null exactly when unconfirmed."
        }
      }
    },
    "dedup": {
      "type": "object",
      "additionalProperties": false,
      "required": [
        "cluster_id",
        "duplicate_of"
      ],
      "properties": {
        "cluster_id": {
          "type": [
            "string",
            "null"
          ]
        },
        "duplicate_of": {
          "type": [
            "string",
            "null"
          ]
        }
      }
    },
    "record_type": {
      "const": "finding",
      "description": "Discriminates ledger record kinds. Findings are 'finding'; identity-lifecycle events are 'supersession' and validate against supersession.schema.json (D-051)."
    },
    "remediation": {
      "type": [
        "string",
        "null"
      ],
      "description": "Recommended remediation, written only by a human at the gate (0.5.0, D-071; the OWASP GenAI Red Teaming Guide 1.0 asks each finding to carry 'specific recommendations for remediation', printed page 44). Null until a human writes it: never-fabricate. The caged --ai path has no remediation capability; a suggested remediation is a parked future --ai job."
    }
  },
  "$defs": {
    "rubric_dimension": {
      "type": [
        "integer",
        "null"
      ],
      "minimum": 0,
      "maximum": 3
    },
    "owasp_llm_entry": {
      "type": "object",
      "additionalProperties": false,
      "required": [
        "id",
        "status"
      ],
      "properties": {
        "id": {
          "type": "string",
          "pattern": "^LLM(0[1-9]|10):2026$",
          "description": "OWASP Top 10 for LLM Applications 2026 id, edition pinned in the value (LLM01:2026 .. LLM10:2026; official PDF fetched 2026-08-25, docs/STANDARDS.md; the 2025 edition is superseded, F-5). A new edition is a deliberate schema bump, never a silent drift."
        },
        "status": {
          "enum": [
            "confirmed",
            "suggested"
          ]
        }
      }
    },
    "saif_entry": {
      "type": "object",
      "additionalProperties": false,
      "required": [
        "id",
        "status"
      ],
      "properties": {
        "id": {
          "type": "string",
          "pattern": "^(DP|UTD|MST|EDH|MXF|MDT|DMS|MRE|IIC|PIJ|MEV|SDD|ISD|IMO|RA)$",
          "description": "Google SAIF risk id, pinned to saif-data commit fe77c44481528b42d01516db9eb75d08054ca21f (15 risks, yaml/risks.yaml, fetched 2026-08-25)."
        },
        "status": {
          "enum": [
            "confirmed",
            "suggested"
          ]
        }
      }
    },
    "atlas_entry": {
      "type": "object",
      "additionalProperties": false,
      "required": [
        "id",
        "status"
      ],
      "properties": {
        "id": {
          "type": "string",
          "pattern": "^AML\\.T[0-9]{4}(\\.[0-9]{3})?$",
          "description": "MITRE ATLAS technique id in the 5.6.0 grammar: AML.T#### or sub-technique AML.T####.### (dist/ATLAS.yaml fetched 2026-08-25)."
        },
        "status": {
          "enum": [
            "confirmed",
            "suggested"
          ]
        }
      }
    }
  }
}
